{
  "schema_version": "1.0",
  "agent_id": "agent_backend_developer",
  "last_heartbeat": "2025-01-08T10:31:30Z",
  "health": "HEALTHY",
  "status": "RUNNING",
  "uptime_seconds": 3600,
  "current_plan_ids": ["plan_a3f5b2c8"],
  "current_task_ids": ["task_001"],
  "resource_usage": {
    "cpu_percent": 12.5,
    "memory_mb": 512,
    "disk_mb": 2048
  },
  "last_error": null
}
